{
  "version": 1,
  "item_id": "2026-09-27-unity-6-6-content-directories",
  "language": "it",
  "editorial_mode": "original",
  "source_item_hash": "36d37f405b93836a99af43c712c730c513fcf5c3c1ebffdbc21fae257d8a387b",
  "written_at": "2026-09-27T17:52:39+00:00",
  "verified_at": "2026-09-27T17:52:39+00:00",
  "sources": [
    {
      "name": "Unity",
      "type": "official",
      "url": "https://unity.com/blog/content-directories-beyond-the-assetbundle"
    }
  ],
  "sections": [
    {
      "heading": "Un’unità di caricamento più piccola",
      "paragraphs": [
        "Con Unity 6.6, le content directories offrono un’alternativa agli AssetBundle distribuiti insieme al Player. Il sistema permette di caricare e scaricare artefatti più granulari, come mesh e texture, evitando di trattare sempre un intero bundle come unità operativa. L’obiettivo è rendere più preciso il controllo della memoria utilizzata dai contenuti."
      ],
      "source_urls": [
        "https://unity.com/blog/content-directories-beyond-the-assetbundle"
      ]
    },
    {
      "heading": "Deduplicazione e integrazione",
      "paragraphs": [
        "Unity descrive una deduplicazione implicita dei contenuti e un nuovo tipo di riferimento caricabile. Per i contenuti locali gestiti con Addressables viene indicato un percorso di adozione senza modifiche al codice. Questa continuità è importante perché permette di valutare il nuovo formato senza confonderlo con una riscrittura obbligatoria di tutta la logica di caricamento."
      ],
      "source_urls": [
        "https://unity.com/blog/content-directories-beyond-the-assetbundle"
      ]
    },
    {
      "heading": "Locale oggi, distribuzione remota come evoluzione",
      "paragraphs": [
        "La distinzione essenziale è fra contenuti consegnati con il Player e aggiornamenti remoti granulari. L’articolo presenta questi ultimi come sviluppo successivo legato a Unity 7, non come capacità già completa di qualsiasi progetto Unity 6.6. I benefici concreti dipendono da struttura degli asset e modalità d’uso: vanno misurati con build e profilazione del proprio target, soprattutto quando memoria e dimensione del gioco sono vincoli importanti."
      ],
      "source_urls": [
        "https://unity.com/blog/content-directories-beyond-the-assetbundle"
      ]
    }
  ]
}
