{
  "version": 1,
  "item_id": "2026-09-28-nocturnal-ii-pc-release-date-2026-09-25",
  "language": "it",
  "editorial_mode": "original",
  "source_item_hash": "bf84aeb192fae8c924e8f570bbfe8ecb368ca83795ce8a1152f6e7b5d8b4d860",
  "written_at": "2026-09-28T07:33:50+02:00",
  "verified_at": "2026-09-28T07:33:00+02:00",
  "sources": [
    {
      "name": "Gematsu · data PC di Nocturnal II",
      "type": "reputable",
      "url": "https://www.gematsu.com/2026/09/nocturnal-ii-for-pc-launches-november-10"
    }
  ],
  "sections": [
    {
      "heading": "La data PC",
      "paragraphs": [
        "Sunnyside Games ha fissato al 10 novembre l’uscita PC di Nocturnal II via Steam. Il sequel resta un metroidvania 2D a scorrimento laterale e punta su un’unica città interconnessa, Ytash, nella quale nuove abilità riaprono percorsi già visitati e permettono di raggiungere aree prima inaccessibili."
      ],
      "source_urls": [
        "https://www.gematsu.com/2026/09/nocturnal-ii-for-pc-launches-november-10"
      ]
    },
    {
      "heading": "Esplorazione e direzione artistica",
      "paragraphs": [
        "La presentazione evidenzia grafica disegnata a mano ispirata all’architettura persiana, movimento e combattimento rapidi e finali segreti che ampliano il mistero dell’isola. L’annuncio riguarda la versione PC e non indica nello stesso aggiornamento altre piattaforme. Per questo entra nel Radar: è una data concreta per un genere seguito, ma non un’uscita imminente."
      ],
      "source_urls": [
        "https://www.gematsu.com/2026/09/nocturnal-ii-for-pc-launches-november-10"
      ]
    }
  ]
}
