{
  "version": 1,
  "item_id": "2026-10-01-microsoft-copilot-september-2026-roundup",
  "language": "it",
  "editorial_mode": "original",
  "source_item_hash": "83c433e0f17a28793523a70e328b58f09b6c0236b750aa64b320cf28c5147652",
  "written_at": "2026-10-01T06:42:00+02:00",
  "verified_at": "2026-10-01T06:41:30+02:00",
  "sources": [
    {
      "name": "Microsoft",
      "type": "official",
      "url": "https://techcommunity.microsoft.com/blog/microsoft-copilot-blog/what%E2%80%99s-new-in-microsoft-copilot--september-2026/4559107"
    }
  ],
  "sections": [
    {
      "heading": "Più controllo sulle fonti e sui plugin",
      "paragraphs": [
        "Il riepilogo Microsoft di settembre raccoglie diversi cambiamenti importanti per chi gestisce Copilot in azienda. Tra questi c’è un registro unificato dei plugin, pensato per centralizzare scoperta e approvazione, e la possibilità di configurare fino a 100 siti SharePoint come fonti autorevoli. Microsoft sta quindi rendendo più esplicita la governance del contesto e degli strumenti a disposizione degli assistenti, invece di lasciare queste scelte distribuite fra esperienze separate."
      ],
      "source_urls": [
        "https://techcommunity.microsoft.com/blog/microsoft-copilot-blog/what%E2%80%99s-new-in-microsoft-copilot--september-2026/4559107"
      ]
    },
    {
      "heading": "Migliora anche il recupero documentale",
      "paragraphs": [
        "Copilot Chat viene aggiornato per trovare meglio contenuto nei PDF scansionati, un dettaglio particolarmente utile quando la knowledge aziendale contiene documenti storici o non nativi digitali. Il riepilogo segnala inoltre componenti SharePoint Framework capaci di comparire direttamente nelle conversazioni Copilot, così l’utente può visualizzare informazioni e interagire con controlli senza uscire dalla chat. Sono evoluzioni da seguire per chi costruisce assistenti basati su SharePoint, ricerca e fonti governate."
      ],
      "source_urls": [
        "https://techcommunity.microsoft.com/blog/microsoft-copilot-blog/what%E2%80%99s-new-in-microsoft-copilot--september-2026/4559107"
      ]
    }
  ]
}
