{
  "version": 1,
  "item_id": "2026-09-28-mercenaries-grace-announcement-2026-09-25",
  "language": "it",
  "editorial_mode": "original",
  "source_item_hash": "7efb4a9bbdcf54baa22937daea1b6b39f546551d626c8cf90d0e15c6d178a5c7",
  "written_at": "2026-09-28T07:33:50+02:00",
  "verified_at": "2026-09-28T07:33:00+02:00",
  "sources": [
    {
      "name": "Gematsu · annuncio Mercenaries Grace",
      "type": "reputable",
      "url": "https://www.gematsu.com/2026/09/mercenaries-grace-black-feather-and-the-golden-right-arm-announced-for-ps5-switch-and-pc"
    }
  ],
  "sections": [
    {
      "heading": "Un nuovo capitolo di Mercenaries Saga",
      "paragraphs": [
        "RideonJapan ha annunciato Mercenaries Grace: Black Feather and the Golden Right Arm, nuovo capitolo della serie Mercenaries Saga. Gematsu riporta un lancio a novembre in Giappone su PlayStation 5, Nintendo Switch e PC via Steam, con una versione inglese già in preparazione."
      ],
      "source_urls": [
        "https://www.gematsu.com/2026/09/mercenaries-grace-black-feather-and-the-golden-right-arm-announced-for-ps5-switch-and-pc"
      ]
    },
    {
      "heading": "Turni alternati unità per unità",
      "paragraphs": [
        "La variazione più interessante riguarda il ritmo del turno: invece di muovere tutta la squadra prima dell’avversario, una singola unità alleata agisce e viene seguita da una singola unità nemica, con una struttura descritta come simile a scacchi o shogi. Ogni mossa è quindi immediatamente esposta a una risposta. Restano ruoli differenziati, crescita dei personaggi, abilità ed equipaggiamento; non è stata indicata una data occidentale precisa."
      ],
      "source_urls": [
        "https://www.gematsu.com/2026/09/mercenaries-grace-black-feather-and-the-golden-right-arm-announced-for-ps5-switch-and-pc"
      ]
    }
  ]
}
