{
  "version": 1,
  "item_id": "2026-10-01-queens-domain-release-date-2026-09-30",
  "language": "it",
  "editorial_mode": "original",
  "source_item_hash": "754986bae7e6dbaaa95b802b2cbb5fe61c6d6f8567c17a06b1b9abe1afb57f8d",
  "written_at": "2026-10-01T06:42:00+02:00",
  "verified_at": "2026-10-01T06:41:30+02:00",
  "sources": [
    {
      "name": "Gematsu",
      "type": "reputable",
      "url": "https://www.gematsu.com/2026/09/queens-domain-launches-october-30-for-ps5-xbox-series-switch-2-and-pc"
    }
  ],
  "sections": [
    {
      "heading": "Un action RPG retrò con una data vicina",
      "paragraphs": [
        "Queen’s Domain uscirà il 30 ottobre su PlayStation 5, Xbox Series X|S, Nintendo Switch 2 e PC. Il progetto riprende l’impostazione dei vecchi RPG in prima persona alla King’s Field e la traduce in un action RPG fantasy dallo stile volutamente retrò. L’esplorazione ruota attorno a un grande labirinto interconnesso, con progressione basata sulla scoperta degli spazi e sul recupero di equipaggiamento più efficace."
      ],
      "source_urls": [
        "https://www.gematsu.com/2026/09/queens-domain-launches-october-30-for-ps5-xbox-series-switch-2-and-pc"
      ]
    },
    {
      "heading": "Combattimento, armi e struttura",
      "paragraphs": [
        "Il combattimento usa una gestione della stamina e richiede di alternare attacchi, difesa e posizionamento. Le informazioni pubblicate indicano oltre 50 armi e più di 100 tra nemici e boss, con la possibilità di adattare il proprio stile man mano che si esplora. Per chi segue RPG, soulslike e giochi portatili, l’arrivo contemporaneo su Switch 2 e sulle altre piattaforme moderne rende il titolo più interessante di un semplice omaggio retrò destinato soltanto a una nicchia PC."
      ],
      "source_urls": [
        "https://www.gematsu.com/2026/09/queens-domain-launches-october-30-for-ps5-xbox-series-switch-2-and-pc"
      ]
    }
  ]
}
